"","x"
"Hydrometeorological modelling for flash flood areas: the case of the 2002 gard event in france","10.1111/J.1753-318X.2009.01023.X"
"Urbas: forecasting and management of flash floods in urban areas","10.1080/15730620902934819"
"Flash flood dynamics and composition in a semiarid mountain watershed","10.1029/2007WR006159"
"Triassic ichnofaunas in distal alluvial fans: evidence from the cerro puntudo formation, cuyo basin, argentina",NA
"Flash flood hazard affected ras gharib city, red sea, egypt: a proposed flash flood channel","10.1007/S11069-017-3030-0"
"Interpreting flash flood palaeoflow parameters from antidunes and gravel lenses: an example from montserrat, west indies","10.1111/SED.12375"
"Flash flooding in arid/semiarid regions: dissecting the hydrometeorology and hydrology of the 19 august 2014 storm and flood hydroclimatology in arizona","10.1175/JHM-D-17-0089.1"
"Rainwater harvesting possibility under climate change: a basin-scale case study over western province of saudi arabia","10.1016/J.ATMOSRES.2017.01.004"
"Monte carlo simulation-aided analytical hierarchy process (ahp) for flood susceptibility mapping in gabes basin (southeastern tunisia)","10.1007/S12665-017-6619-4"
"A high space-time resolution dataset linking meteorological forcing and hydro-sedimentary response in a mesoscale mediterranean catchment (auzon) of the ardeche region, france","10.5194/ESSD-9-221-2017"
"Genetics, physiological mechanisms and breeding of flood-tolerant rice (oryza sativa l.)","10.1093/PCP/PCW206"
"Recent precipitation trends, flash floods and landslides in southern brazil","10.1088/1748-9326/11/11/114029"
"Analysis of damaging hydrogeological events in a mediterranean region (calabria)","10.1016/J.JHYDROL.2015.12.041"
"Changes in the physical characteristics of the water column at the mouth of a torrent during an extreme rainfall event","10.1016/J.JHYDROL.2015.12.009"
"``we are more scared of the power elites than the floods: adaptive capacity and resilience of wetland community to flash flood disasters in bangladesh","10.1016/J.IJDRR.2016.08.004"
"Operational hydrological forecasting during the iphex-iop campaign - meet the challenge","10.1016/J.JHYDROL.2016.02.019"
"Potentialities of ensemble strategies for flood forecasting over the milano urban area","10.1016/J.JHYDROL.2016.05.023"
"Using palynology to re-assess the dead sea laminated sediments - indeed varves?","10.1016/J.QUASCIREV.2016.03.024"
"Flood and drought tolerance in rice: opposite but may coexist","10.1002/FES3.79"
"Geoinformatics application for assessing the morphometric characteristics' effect on hydrological response at watershed (case study of wadi qanunah, saudi arabia)","10.1007/S12517-015-2300-Y"
"A mechanistic integrated geochemical and chemical-flooding tool for alkaline/surfactant/polymer floods",NA
"Impact assessment of uncertainty propagation of ensemble nwp rainfall to flood forecasting with catchment scale","10.1155/2016/1384302"
"Simulation of flash floods in ungauged basins using post-event surveys and numerical modelling","10.1111/JFR3.12103"
"Using high-resolution numerical weather forecasts to improve remotely sensed rainfall estimates: the case of the 2013 colorado flash flood","10.1175/JHM-D-14-0207.1"
"Study of landslide hazard zonation in mandakini valley, rudraprayag district, uttarakhand using remote sensing and gis",NA
"Implementation of a hydrologic model and gis for estimating wadi runoff in dernah area, al jabal al akhadar, ne libya","10.1016/J.JAFREARSCI.2015.03.022"
"Adjustment to the curve number (nrcs-cn) to account for the vegetation effect on hydrological processes","10.1080/02626667.2014.898119"
"Sediment transport during flood event: a review","10.1007/S13762-014-0689-6"
"Relocating a flood-affected community: good planning or good politics?","10.1080/01944363.2014.976586"
"Assessment of flash flood warning procedures","10.1029/1999JD900125"
"Basin-scale analysis of the geomorphic effectiveness of flash floods: a study in the northern apennines (italy)","10.1016/J.SCITOTENV.2018.05.252"
"Money doesn't grow on trees, but forecasts do: forecasting extreme precipitation with random forests","10.1175/MWR-D-17-0250.1"
"Uncertainty estimation of intensity-duration-frequency relationships: a regional analysis","10.1016/J.JHYDROL.2017.07.054"
"Simulating flash floods at hourly time-step using the swat model","10.3390/W9120929"
"Nutrient load modelling during floods in intermittent rivers: an operational approach","10.1016/J.ENVSOFT.2007.09.008"
"Kinematic wave model for transient bed profiles in alluvial channels under nonequilibrium conditions","10.1029/2006WR005681"
"Nearshore dynamics of nutrients and chlorophyll during mediterranean-type flash-floods","10.1051/ALR:2007011"
"Geographical analysis of river floods and their causes in southern east siberia","10.1623/HYSJ.51.3.450"
"Viscous and two-phase debris flows in southern chins's yunnan plateau","10.1080/02508060508691832"
"Patterns of cloud-to-ground lightning and convective rainfall associated with postwildfire flash floods and debris flows in complex terrain of the western united states","10.1175/1525-7541(2004)005<0989:POCLAC>2.0.CO;2"
"Comparison of adaptability to flash flood between rice cultivars differing in flash flood tolerance","10.1080/00380768.2002.10409254"
"Characteristics and environmental conditions of quasi-stationary convective clusters during the warm season in japan","10.1002/QJ.2726"
"Self-accelerated development of salt karst during flash floods along the dead sea coast, israel","10.1002/2015JF003738"
"The effect of the balcones escarpment on three cases of extreme precipitation in central texas","10.1175/MWR-D-15-0156.1"
"Predicting extreme rainfall events over jeddah, saudi arabia: impact of data assimilation with conventional and satellite observations","10.1002/QJ.2654"
"Use of a flood-routing model to assess lateral flows in a karstic stream: implications to the hydrogeological functioning of the grands causses area (tarn river, southern france)","10.1007/S12665-015-4704-0"
"On the prediction of steady-state wear rate in spur gears","10.1016/J.WEAR.2015.08.010"
"Resolution dependence of initiation and upscale growth of deep convection in convection-allowing forecasts of the 31 may-1 june 2013 supercell and mcs","10.1175/MWR-D-15-0179.1"
"Dating of debris flow fan complexes from lantau island, hong kong, china: the potential relationship between landslide activity and climate change","10.1016/J.GEOMORPH.2015.07.041"
"Mapping underground layers in the super arid gidron wadi using electrical resistivity tomography (ert)","10.1016/J.JARIDENV.2015.05.008"
"Identification of prevailing storm runoff generation mechanisms in an intensively cultivated catchment","10.1515/JOHH-2015-0022"
"The simulated structure and evolution of a quasi-idealized warm-season convective system with a training convective line","10.1175/JAS-D-14-0215.1"
"Effect of simulated flash flooding on rice and its recovery after flooding with nutrient management strategies","10.1016/J.ECOLENG.2015.01.033"
"Fish invading deserts: non-native species in arid moroccan rivers","10.1002/AQC.2487"
"Development of new submergence tolerant rice variety for bangladesh using marker-assisted backcrossing","10.1016/J.RSCI.2015.05.003"
"A physically based distributed hydrological model of wadi system to simulate flash floods in arid regions","10.1007/S12517-013-1190-0"
"Arroyo channel head evolution in a flash-flood-dominated discontinuous ephemeral stream system","10.1130/B31064.1"
"The relationship between thermal regime alteration and spawning delay of the four major chinese carps in the yangtze river below the three gorges dam","10.1002/RRA.2691"
"River plume dispersion in response to flash flood events. Application to the catalan shelf","10.1016/J.CSR.2014.06.007"
"Formulas for the peak discharge from breached earthfill dams","10.1061/(ASCE)HY.1943-7900.0000796"
"Comparing satellite rfe data with surface gauges for 2012 extreme storms in african east sahel","10.1080/2150704X.2013.787498"
"Correlation of early and mid-holocene events using magnetic susceptibility in estuarine cores from bays along the northwestern gulf of mexico","10.1016/J.PALAEO.2012.05.024"
"Climate change in a small transboundary tributary of the syr darya calls for effective cooperation and adaptation","10.1659/MRD-JOURNAL-D-11-00127.1"
"Morphometric analysis of the ladhiya and lohawati river basins, kumaun lesser himalaya, india","10.1127/0372-8854/2012/0067"
"An integrated study for the evaluation of natural and anthropogenic causes of flooding in small catchments based on geomorphological and meteorological data and modeling techniques: the case of the xerias torrent (corinth, greece)","10.1127/0372-8854/2012/S-00072"
"Estimating flash flood peak discharge in gidra and parna basin: case study for the 7-8 june 2011 flood","10.2478/V10098-012-0018-Z"
"Flash flood routing modeling for levee-breaks and overbank flows due to typhoon events in a complicated river system","10.1007/S11069-010-9711-6"
"A numerical study of the rainstorm characteristics of the june 2005 flash flood with wrf/gsi data assimilation system over south-east china","10.1002/HYP.7882"
"South african weather service operational satellite based precipitation estimation technique: applications and improvements","10.5194/HESS-15-1131-2011"
"Inclusion of potential vorticity uncertainties into a hydrometeorological forecasting chain: application to a medium size basin of mediterranean spain","10.5194/HESS-13-793-2009"
"Dynamics governing a simulated mesoscale convective system with a training convective line","10.1175/JAS-D-15-0199.1"
"An initial assessment of radar data assimilation on warm season rainfall forecasts for use in hydrologic models","10.1175/WAF-D-14-00125.1"
"Improving high-resolution quantitative precipitation estimation via fusion of multiple radar-based precipitation products","10.1016/J.JHYDROL.2015.04.066"
"Decadal evolution of a spit in the baram river mouth in eastern malaysia","10.1016/J.CSR.2015.06.006"
"Infiltration into two-layered soil: the green-ampt and averyanov models revisited","10.1007/S11242-015-0507-8"
"Lagrangian analyses of rainfall structure and evolution for organized thunderstorm systems in the urban corridor of the northeastern united states","10.1175/JHM-D-14-0095.1"
"Effects of urban form on wadi flow frequency analysis in the wadi aday watershed in muscat, oman","10.1080/1573062X.2013.857420"
"Pseudo-backcrossing design for rapidly pyramiding multiple traits into a preferential rice variety","10.1186/S12284-014-0035-0"
"Numerical modelling of heavy rainfall event over madeira island in portugal: sensitivity to different micro physical processes","10.1002/MET.1375"
"Experimental study of debris flow caused by domino failures of landslide dams","10.1016/S1001-6279(14)60055-X"
"Formation of fine sediment deposit from a flash flood river in the mediterranean sea","10.1002/2014JC010187"
"Rainfall organization control on the flood response of mild-slope basins","10.1016/J.JHYDROL.2013.12.013"
"A review of the assessment and mitigation of floods in sindh, pakistan","10.1007/S11069-013-0850-4"
"A coupling of hydrologic and hydraulic models appropriate for the fast floods of the gardon river basin (france)","10.5194/NHESS-14-2899-2014"
"Ensemble-based analysis of the may 2010 extreme rainfall in tennessee and kentucky","10.1175/MWR-D-13-00020.1"
"Numerical modeling of 3-d flow on porous broad crested weirs","10.1016/J.APM.2013.04.041"
"Management of flood hazard via hydro-morphological river modelling. The case of the mallero in italian alps","10.1111/J.1753-318X.2012.01170.X"
"Adapting the coupled hydrological model isba-topmodel to the long-term hydrological cycles of suburban rivers: evaluation and sensitivity analysis","10.1016/J.JHYDROL.2012.06.059"
"Benefits and limitations of data assimilation for discharge forecasting using an event-based rainfall-runoff model","10.5194/NHESS-13-583-2013"
"Evidence for flash floods over deserts from loss of coherence in insar imagery","10.1029/2012JD017580"
"Effects of shallow and deep sediment disturbance on whole-stream metabolism in experimental sand-bed flumes","10.1007/S10750-011-0968-X"
"Molecularly-engineered lubricants: synthesis, activation, and tribological characterization of silver complexes as lubricant additives","10.1002/ADEM.201100193"
"Ict approaches to integrating institutional and non-institutional data services for better understanding of hydro-meteorological phenomena","10.5194/NHESS-12-1961-2012"
"Can the discharge of a hyperconcentrated flow be estimated from paleoflood evidence?","10.1029/2011WR010380"
"Hydrologic controls on wash load sediment concentrations within a low-ordered, ephemeral watershed","10.1016/J.JHYDROL.2011.09.011"
"Sensitivity of a mesoscale model to different convective parameterization schemes in a heavy rain event","10.5194/NHESS-11-343-2011"
"Dynamics of plant bioresources in western himalayan region of india - watershed based study",NA
"Calibration of structure in a distributed forecasting model for a semiarid flash flood: dynamic surface storage and channel roughness","10.1016/J.JHYDROL.2009.08.024"
"Presence and histopathological effects of the parvatrema sp (digenea, gymnophallidae) in the stout razor clam tagelus plebeius (bivalvia, psammobiidae)","10.1016/J.JIP.2009.05.014"
"Dealing with uncertainty: an analysis of the severe weather events over italy in 2006","10.5194/NHESS-9-1775-2009"
"Evaluation of statistical rainfall disaggregation methods using rain-gauge information for west-central florida","10.1061/(ASCE)1084-0699(2008)13:12(1158)"
"Life-history of the south american darter, characidium pterostictum (crenuchidae): evidence for small scale spatial variation in a piedmont stream","10.1590/S1679-62252008000400007"
"Generation, transport and preservation of armoured mudballs in an ephemeral gully system","10.1016/J.GEOMORPH.2007.10.030"
"Implementation of the topkapi model in south africa: initial results from the liebenbergsvlei catchment",NA
"Flash flooding resistance of rice genotypes of oryza sativa l., o-glaberrima steud., and interspecific hybridization progeny","10.1016/J.ENVEXPBOT.2007.12.001"
"On the meteorological mechanisms driving postfire flash floods: a case study","10.1175/2007MWR2218.1"
"On adapting pqpfs to fit hydrological needs: the case of flash flood forecasting","10.1002/ASL.176"
"Wildcense: gps based animal tracking system","10.1109/ISSNIP.2008.4762058"
"Changing features of extreme precipitation in the yangtze river basin during 1961-2002","10.1007/S11442-007-0033-X"
"Geomorphological method in the elaboration of hazard maps for flash-floods in the municipality of jucuaran (el salvador)","10.5194/NHESS-7-455-2007"
"The heavy rain event of 29 october 2000 in hana, maui","10.1175/WAF868.1"
"Flood reconstructions in the namib desert, namibia and little ice age climatic implications: evidence from slackwater deposits and desert soil sequences",NA
"Response of ips typographus (scolytidae : coleoptera) and other bark- and wood-boring beetles to a flash-flood event","10.1080/02827580308619"
"Hydrometeorological characteristics of flash floods",NA
"A comparison of five flood rain events over the new south wales north coast and a case study","10.1002/(SICI)1097-0088(200004)20:5<543::AID-JOC498>3.0.CO;2-C"
"Rare flash floods and debris flows in southern germany","10.1016/J.SCITOTENV.2018.01.172"
"Convective rainfall in a dry climate: relations with synoptic systems and flash-flood generation in the dead sea region","10.5194/HESS-21-5165-2017"
"Impact of rainfall assimilation on high-resolution hydrometeorological forecasts over liguria, italy","10.1175/JHM-D-17-0073.1"
"Impact of aeolian dry deposition of reactive iron minerals on sulfur cycling in sediments of the gulf of aqaba","10.3389/FMICB.2017.01131"
"Excess river sedimentation at bridges in the raya graben (northern ethiopia)","10.1002/LDR.2572"
"Landslides, floods and sinkholes in a karst environment: the 1-6 september 2014 gargano event, southern italy","10.5194/NHESS-17-467-2017"
"Post flash flood survey: the 14th and 15th october 2015 event in the paupisi-solopaca area (southern italy)","10.1080/17445647.2016.1249034"
"Field evaluation of mixed-seedlings with rice to alleviate flood stress for semi-arid cereals","10.1016/J.EJA.2016.07.003"
"Accounting for rainfall systematic spatial variability in flash flood forecasting","10.1016/J.JHYDROL.2015.08.024"
"Diagnostic study of a high-precipitation event in the western mediterranean: adequacy of current operational networks","10.1002/QJ.2600"
"Evaluation of two convection-permitting ensemble systems in the hymex special observation period (sop1) framework","10.1002/QJ.2859"
"Analysis of frequency and magnitude of extreme rainfall events with potential impacts on flooding: a case study from the central united states","10.1002/JOC.4577"
"Gis-based approach for flood analysis: case study of kecidere flash flood event (turkey)","10.1080/10106049.2015.1047411"
"Structure and evolution of flash flood producing storms in a small urban watershed","10.1002/2015JD024478"
"Characterizing submergence survival strategy in rice via chlorophyll fluorescence","10.1111/J.1439-037X.2011.00494.X"
"Longitudinal stage profiles forecasting in rivers for flash floods","10.1016/J.JHYDROL.2010.05.028"
"Dynamic routing modeling for flash flood forecast in river system","10.1007/S11069-009-9394-Z"
"Reconstructing an extreme flood from boulder transport and rainfall-runoff modelling: wadi isla, south sinai, egypt","10.1016/J.GLOPLACHA.2009.11.008"
"Flood management and flood warning system in china","10.1002/IRD.513"
"Textural and compositional characterization of wadi feiran deposits, sinai peninsula, egypt, using radarsat-1, palsar, srtm and etm plus data","10.3390/RS2010052"
"Evaluating the impact of lightning data assimilation on mesoscale model simulations of a flash flood inducing storm","10.1016/J.ATMOSRES.2009.05.008"
"Flash flood forecasting by statistical learning in the absence of rainfall forecast: a case study",NA
"Nesting ecology of podocnemis erythrocephala (testudines,podocnemididae) of the rio negro, amazonas, brazil","10.2744/CCB-0611.1"
"Resuspension potential of surficial sediments in saguenay fjord (quebec, canada)","10.1016/J.MARGEO.2005.07.001"
"Air-water and momentum exchanges in unsteady surging waters: an experimental study","10.1016/J.EXPTHERMFLUSCI.2005.03.017"
"Diversity and stability of aquatic macrophyte community in three shallow lakes associated to a floodplain system in the south of brazil",NA
"A large landslide on the urban fringe of metropolitan phoenix, arizona","10.1016/J.GEOMORPH.2004.09.022"
"Predictability of prototype flash flood events in the western mediterranean under uncertainties of the precursor upper-level disturbance: the hydroptimet case studies","10.5194/NHESS-5-505-2005"
"Distributed denial of service detection using tcp/ip header and traffic measurement analysis",NA
"Dam-breach flood wave propagation using dimensionless parameters","10.1061/(ASCE)0733-9429(2003)129:10(777)"
"Application of kinematic wave theory for predicting flash flood hazards on coupled alluvial fan-piedmont plain landforms","10.1002/HYP.1241"
"Desalination of brackish groundwater in egypt","10.1016/S0011-9164(02)01044-5"
"Some meteorological characteristics of significant tornado events occurring in proximity to flash flooding","10.1175/1520-0434(2002)017<0155:SMCOST>2.0.CO;2"
"Photocopying living chains. 2. Time-dependent measurements","10.1021/MA0100798"
"Synoptic-scale control over modern rainfall and flood patterns in the levant drylands with implications for past climates","10.1175/JHM-D-18-0013.1"
"When will we detect changes in short-duration precipitation extremes?","10.1175/JCLI-D-17-0435.1"
"Integrated automatic and continuous bedload monitoring in gravel bed rivers","10.1016/J.GEOMORPH.2016.10.020"
"Triggering and evolution of a deep convective system in the mediterranean sea: modelling and observations at a very fine scale","10.1002/QJ.2977"
"Comparing different infiltration methods of the hec-hms model: the case study of the mesima torrent (southern italy)","10.1002/LDR.2591"
"Hydrometeorological characterization of a flash flood associated with major geomorphic effects: assessment of peak discharge uncertainties and analysis of the runoff response","10.1175/JHM-D-16-0081.1"
"Synoptic situations of extreme hourly precipitation over china","10.1175/JCLI-D-16-0057.1"
"A geochemical and sedimentological perspective of the life cycle of neapolis harbor (naples, southern italy)","10.1016/J.QUASCIREV.2016.08.026"
"Flash flood detection in urban cities using ultrasonic and infrared sensors","10.1109/JSEN.2016.2592359"
"Severe convection in the mediterranean from microwave observations and a convection-permitting model","10.1002/QJ.2611"
"Summer-time lightning activity and its relation with precipitation: diurnal variation over maritime, coastal and continental areas","10.1016/J.ATMOSRES.2012.10.015"
"Forecasting flash floods using data-based mechanistic models and nora radar rainfall forecasts","10.1080/02626667.2013.842647"
"Mass and energy flux estimates at different spatial resolutions in a heterogeneous area through a distributed energywater balance model and remote-sensing data","10.1080/01431161.2012.716924"
"Well-balanced shallow water flow simulation on quadtree cut cell grids","10.1016/J.ADVWATRES.2012.01.003"
"Runoff, erosion, and the sustainability of ancient irrigation systems in the central negev desert",NA
"Forensic hydro-meteorological analysis of an extreme flash flood: the 2016-05-29 event in braunsbach, sw germany","10.1016/J.SCITOTENV.2018.02.241"
"Review of urban surface parameterizations for numerical climate models","10.1016/J.UCLIM.2017.10.006"
"Vehicle classification and speed estimation using combined passive infrared/ultrasonic sensors","10.1109/TITS.2017.2727224"
"Open storm: a complete framework for sensing and control of urban watersheds","10.1039/C7EW00374A"
"Physiological responses to alternative flooding and drought stress episodes in two willow (salix spp.) Clones","10.1139/CJFR-2016-0202"
"Analysis of a localized flash-flood event over the central mediterranean","10.1016/J.ATMOSRES.2016.08.007"
"Assessing the impact of arid area urbanization on flash floods using gis, remote sensing, and hec-hms rainfall-runoff modeling","10.2166/NH.2016.133"
"Is there really ``nothing you can do? Pathways to enhanced flood-risk preparedness","10.1016/J.JHYDROL.2016.10.009"
"Upper limits of flash flood stream power in europe","10.1016/J.GEOMORPH.2015.11.005"
"Moving boulders in flash floods and estimating flow conditions using boulders in ancient deposits","10.1111/SED.12274"
"Estimating a-priori kinematic wave model parameters based on regionalization for flash flood forecasting in the conterminous united states","10.1016/J.JHYDROL.2016.06.011"
"Within- and among-population variation in vital rates and population dynamics in a variable environment","10.1890/15-1808.1"
"Role of silica and nitrogen interaction in submergence tolerance of rice","10.1016/J.ENVEXPBOT.2016.02.008"
"Facies architecture and palaeoenvironmental implications of the upper cretaceous (santonian) csehbanya formation at the iharkut vertebrate locality (bakony mountains, northwestern hungary)","10.1016/J.PALAEO.2015.10.018"
"Rapid proliferation of vibrio parahaemolyticus, vibrio vulnificus, and vibrio cholerae during freshwater flash floods in french mediterranean coastal lagoons","10.1128/AEM.01848-15"
"Modeling of natural dam failure modes and downstream riverbed morphological changes with different dam materials in a flume test","10.1016/J.ENGGEO.2015.01.016"
"The character and causes of flash flood occurrence changes in mountainous small basins of southern california under projected climatic change","10.1016/J.EJRH.2014.02.003"
"Assessing the simple dynamical systems approach in a mediterranean context: application to the ardeche catchment (france)","10.5194/HESS-19-2427-2015"
"Natural hazards versus climate change and their potential impacts in the dry, northern himalayas: focus on the upper kali gandaki (mustang district, nepal)","10.1007/S12665-014-3087-Y"
"A process-based analysis of the suitability of copula types for peak-volume flood relationships","10.5194/PIAHS-370-183-2015"
"Rainfall-runoff modeling in a flashy tropical watershed using the distributed hl-rdhm model","10.1016/J.JHYDROL.2014.09.042"
"Self-organising maps and correlation analysis as a tool to explore patterns in excitation-emission matrix data sets and to discriminate dissolved organic matter fluorescence components","10.1371/JOURNAL.PONE.0099618"
"Forcing mechanisms of a heavy precipitation event in the southeastern adriatic area","10.1007/S11069-014-1066-Y"
"Catchment-scale storm velocity: quantification, scale dependence and effect on flood response","10.1080/02626667.2014.923889"
"Photocopying living chains. 1. Steady-state","10.1021/MA010078F"
"Dealing with flash floods: contemporary issues and future possibilities",NA
"Sensitivity of the wrf model to the lower boundary in an extreme precipitation event - madeira island case study","10.5194/NHESS-14-2009-2014"
"Evaluating a mesoscale atmosphere model and a satellite-based algorithm in estimating extreme rainfall events in northwestern turkey","10.5194/NHESS-14-611-2014"
"Asian aquarium fishes in a neotropical biodiversity hotspot: impeding establishment, spread and impacts","10.1007/S10530-013-0443-X"
"Wildfire and aspect effects on hydrologic states after the 2010 fourmile canyon fire","10.2136/VZJ2012.0089"
"The 20 february 2010 madeira island flash-floods: vhr satellite imagery processing in support of landslide inventory and sediment budget assessment","10.5194/NHESS-13-709-2013"
