"","x"
"Modelling of flood prediction system using hybrid nnarx and extended kalman filter",NA
"The rapid development of settlements in flood-prone areas in peri-urban ulaanbaatar, mongolia: monitoring and spatial analysis using vhr satellite imageries","10.1007/978-4-431-56442-3\_8"
"Investigation methods of mountain torrent disaster in wulian county of shandong province",NA
"Sedimentary and geomorphic signatures of a cloud burst and triggered flash floods in the indus valley of ladakh himalaya",NA
"Could we beat a new mimicking attack?",NA
"A behavior-based method for distinction of flooding ddos and flash crowds","10.1007/978-3-319-63558-3\_11"
"Detecting flooding ddos under flash crowds based on mondrian forest","10.1007/978-3-319-60033-8\_62"
"Utilization of gps tropospheric delays for climate research","10.1088/1742-6596/846/1/012001"
"The design of flood protection in koberice municipality","10.1088/1755-1315/92/1/012062"
"Cartography of 150 years of hydrogeomorphological catastrophic occurrences, portugal mainland a territory of concern",NA
"Heavy rains and flash floods at rocky coast. The costiera amalfitana (southern italy)","10.1007/978-3-319-53485-5\_38"
"Integrated hydrographical basin management. Study case - crasna river basin","10.1088/1757-899X/245/3/032038"
"The geographical setting for integrated water resource management in the guanting basin",NA
"Penetration jet impingement calculation in engineering application",NA
"Torrential erosion: himalayas","10.1081/E-ESS3-120053783"
"Root wood anatomy of a black pine tree: landslide traces","10.17475/KASTORMAN.295309"
"Hydraulic flood routing in an ephemeral channel: wadi mekerra, algeria","10.1007/S40808-016-0237-0"
"Improving drowned drainage outlets with submerged orifices","10.2166/WPT.2016.091"
"Flash floods and desert claims",NA
"Infiltration losses calculated for the flash flood in the upper catchment of geru river, galati county, romania","10.1515/PESD-2016-0039"
"Mesoscale and synoptic environment in three orographically enhanced rain events on the coast of santa catarina (brazil)","10.1175/WAF-D-15-0003.1"
"Building climate resilient agriculture through traditional floating rice in flash flood affected areas of the north bank plains zone of assam",NA
"An estimation of regional geologic structures from the geomorphology to characterize the wadi systems, southeast sinai, egypt","10.1190/INT-2015-0125.1"
"Preliminary analysis of the afforestation role in the maximum runoff in valea rece catchment","10.1515/PESD-2017-0016"
"Analysis of flash floods in germany",NA
"Flash floods: the role of science, forecasting, and communications in reducing loss of life and economic disruptions an information statement of the american meteorological society adopted by the ams council on april 17, 2017",NA
"Sediment dynamics of an allogenic river channel in a very arid environment","10.1002/HYP.11171"
"Visualization of urban floodplains in the amazon foothill using the geo-inspired model of natural vector multiagents (avng)",NA
"Operational quality control and enhancement of radar data to support regional flash flood warning systems","10.1061/(ASCE)HE.1943-5584.0001345"
"A comparison of ensemble strategies for flash flood forecasting: the 12 october 2007 case study in valencia, spain","10.1175/JHM-D-16-0281.1"
"The analysis of time distribution of rainfall in heavy storms","10.1590/S1413-41522016146750"
"Geotechnical measures for uttarakhand flash flood-2013, india",NA
"Enclave ecology: hardening the land-sea edge to provide freshwater in singapore's hydrohub",NA
"New method of curve number derivation with inferential statistics",NA
"Insight into variability of spring and flash flood events in lithuania","10.1007/S11600-017-0009-X"
"Landscapes of the medieval commons in villanueva, asturias, spain","10.5334/PIA-518"
"Blocked drains syndrome: physical degradation of the storm drainage system in a compact city","10.1166/ASL.2017.8388"
"Stormwater as a criterion for green highway",NA
"Study the impact of rainfalls on the united arab emirates dams using remote sensing and image processing techniques","10.1117/12.2278509"
"A reactive early warning model for urban flash flood management",NA
"Soft computing and data mining techniques for thunderstorms and lightning prediction: a survey",NA
"Urban flood warning system social benefits",NA
"Analyzing social media texts and images to assess the impact of flash floods in cities",NA
"Preliminary study of the flooding characteristics on proluvial fan under different peak discharges","10.1088/1755-1315/69/1/012022"
"Flash flood hazard assessment in an ungauged piedmont basin in the sierras pampeanas western region, province of cordoba, argentina","10.1007/978-3-319-54371-0\_7"
"Constrained lms for dynamic flow networks",NA
"Flood prediction at the northern region of uae","10.1051/MATECCONF/201710304004"
"Towards the experimental assessment of the dqe in spect scanners","10.1088/1742-6596/931/1/012021"
"Entropy-score: a method to detect ddos attack and flash crowd",NA
"Children and families",NA
"Analysis of total precipitable water and cloud liquid water from mwhts and acmr observations",NA
"Applied prospect of modern information technology in relation to mountain flood disaster monitoring and early warning system","10.1080/02522667.2017.1367498"
"Flashflood simbach 2016: documentation and analysis",NA
"Identifying flood-prone risk areas, using gis. Case study: ozana drainage basin, romania","10.18509/GBP.2018.58"
"Using big data in early warning system of flash floods in mauritius",NA
"An adaptive model for detection and prevention of ddos and flash crowd flooding attacks",NA
"Identification of flash floods using soil flux and co2: an implementation of neural network with less false alarm rate","10.30880/IJIE.2018.10.07.014"
"Morphometric, geomorphologic and flood hazard analysis of an arid mountain river basin, central pre-andes of argentina. Southwestern south america","10.4461/GFDQ.2018.41.6"
"Flash flood disasters analysis and evaluation: a case study of yiyang county in china","10.1088/1755-1315/128/1/012035"
"Intelligent high-performance dynamic control for two-stage screw high-temperature heat pump system","10.18494/SAM.2018.2070"
"Evaluation of sub daily satellite rainfall estimates through flash flood modelling in the lower middle zambezi basin","10.5194/PIAHS-378-59-2018"
"Uttarakhand calamity: a climate revelation in the bhagirathi river valley uttarakhand, india","10.1007/978-981-10-3310-0\_10"
"Low-impact development: minimising stormwater runoff in a case study of section 13, shah alam, malaysia","10.2495/WRM170201"
"Catastrophes and deaths along tanzania's western indian ocean coast during the early swahili period, ad 900-1100","10.1080/0067270X.2018.1473208"
"Csdsm: cognitive switch-based ddos sensing and mitigation in sdn-driven cdni word","10.2298/CSIS170328044M"
"Potential impact of climate change on rainfall extremes for urban drainage management",NA
"Ecological stability at the time of the stable cadastre and today",NA
"Dinosaur behaviour in an early jurassic palaeoecosystem - uppermost elliot formation, ha nohana, lesotho","10.14241/ASGP.2018.010"
"Land cover change, surface mining, and their impacts on a heavy rain event in the appalachia","10.1080/24694452.2018.1460249"
"Broadcast storm problem-a hidden consequence of content distribution in content delivery networks","10.1007/978-981-10-4585-1\_13"
"Social auto-scaling","10.1109/PDP2018.2018.00033"
"Stochastic generation of hourly rainfall series in the western region of peninsular malaysia","10.21833/IJAAS.2018.01.013"
"Evaluation of landslide hazard levels post 2014 flood disaster in manado city",NA
"Modified flash flood potential index in order to estimate areas with predisposition to water accumulation","10.1515/GEO-2018-0047"
"Modeling of flash floods in wadi systems using a robust shallow water model-case study el gouna, egypt","10.1007/978-981-10-7218-5\_41"
"Spatiotemporal characteristics of hourly rainfall in the upper reaches of hanjiang river basin",NA
"Formulation of rainfall warning indicators for disaster prevention objects in hilly area based on nam model","10.1088/1755-1315/208/1/012016"
"Flash flood early warning system using mini pc case study: mount nago water reservoir",NA
"Experiencing stem through first lego league",NA
"Application of the hec-hms model for flood simulation in ungauged mountainous area",NA
"Analogue gpr study of the permian fanglomerates from zygmuntowka quarry near checiny, holy cross mountains, southern poland, for construction of a training image for multiple point simulations","10.7306/GQ.1438"
"Optimisation of morphometric parameters of limbang river basin, borneo in the equatorial tropics for terrain characterisation","10.1007/S40808-017-0394-9"
"Farmers' responses to changing hydrological trends in the niger basin parts of benin","10.3390/HYDROLOGY4040052"
"Qualitative study of disaster preparedness in an indonesian village: interviews with survivors of flash flooding near bandung","10.1515/MGRSD-2017-0028"
"Temporal analysis of rainfall categories in southern italy (calabria region)","10.1007/S40710-017-0215-1"
"Using an integrated remote sensing approach for identification of bedrock and alluvium along the front range mountains, colorado","10.1117/1.JRS.11.046009"
"Comment on `the influence of geological-morphological and land-use settings on shallow landslides in the pogliaschina t. Basin (northern apennines, italy)' by bartelletti et al. (2017)","10.1080/17445647.2017.1376227"
"The effect of data granularity on prediction of extreme hydrological events in highly urbanized watersheds: a supervised classification approach","10.1016/J.ENVSOFT.2017.06.037"
"Process-based modelling of surface runoff generation and concentration in a small pre-alpine catchment","10.5675/HYWA\_20175\_3"
"Severe hydrometeorological events in liguria region: calibration and validation of a meteorological indices-based forecasting operational tool","10.1002/MET.1653"
"A synoptic and mesoscale analysis of heavy rainfall at portland, maine, 13-14 august 2014","10.15191/NWAJOM.2017.0507"
"A rule-based mechanism for detecting http denial of service attacks during flash crowd event","10.1166/ASL.2017.7391"
"Floods and droughts: seasonal water fluctuations and the origin of the major water projects in the northwest basins of cordoba - argentina (1880-1925)",NA
"Coupling of 1d models (swat and swmm) with 2d model (iric) for mapping inundation in brahmani and baitarani river delta","10.1007/S11069-018-3281-4"
"Reservoir's geometry impact of three dimensions on peak discharge of dam-failure flash flood","10.24200/SCI.2017.4467"
"Study of the vegetation and its effects on the fluvial dynamics in mountain basins. Argentina",NA
"Using the multisensor advected layered precipitable water product in the operational forecast environment","10.15191/NWAJOM.2018.0606"
"The floodscale experiment in the small catchment of valescure, france: an overview of the isotopic and geochemical data base","10.1002/GDJ3.57"
"Model for dilution process of landslide triggered debris flows -a case in the guanba river, southeastern tibetan plateau","10.15446/ESRJ.V22N2.68177"
"The analysis of the flash flood produced during 02-04.06.2016 in the trotus river basin (romania)","10.2478/PESD-2018-0014"
"A preliminary look at using rainfall average recurrence interval to characterize flash flood events for real-time warning forecasting","10.15191/NWAJOM.2018.0602"
"Flood proofing of ranjit, a popular variety of north-eastern india through transfer of sub1 rice qtl by modified marker-assisted backcross breeding","10.5958/0975-6906.2018.00021.4"
"Evaluation of quantitative precipitation predictions by ecmwf, cma, and ukmo for flood forecasting: application to two basins in china","10.1061/(ASCE)NH.1527-6996.0000282"
"Heavy rainfall characteristics at south-west of mt. Merapi- yogyakarta and central java province, indonesia","10.21660/2018.45.27559"
"Monitoring and assessment of the groundwater quality in wadi al-arish downstream area, north sinai (egypt)","10.1016/J.JAFREARSCI.2018.01.016"
"Geomorphology and pedology of the engaruka archaeological environment, tanzania, and the effects of the 1997-1998 el nino flash-flood","10.1016/J.CATENA.2017.12.024"
"Remote sensing analysis of changes in chorabari glacier, central himalaya, india","10.18520/CS/V114/I04/771-775"
"Assessment and management flash flood in najran wady using gis and remote sensing","10.1007/S12524-017-0670-1"
"Reprint of ``a robust reliable energy-aware urgent computing resource allocation for flash-flood ensemble forecasting on hpc infrastructures for decision support","10.1016/J.FUTURE.2016.11.015"
"Soil erosion in sierras chicas cordoba: a rusle model analysis with remote sensing data",NA
"Storm water management approach to increase the quality of urban streetscape in sudirman street, bogor city","10.1088/1755-1315/179/1/012019"
"Temporal changes in atmospheric water content during the december 2004 sumatra earthquake as estimated from gps signals and its possible connection to the january 2005 california flash flood","10.4401/AG-7561"
"Economic impact due to cimanuk river flood disaster in garut district using cobb-douglas analysis with least square method","10.1088/1757-899X/332/1/012050"
"Flood risk assessment of river kabul and swat catchment area: district charsadda, pakistan.","10.5194/ISPRS-ARCHIVES-XLII-4-W9-105-2018"
"Consequences of the river valley bottom transformation after extreme flood (on the example of the niida river, japan)","10.1088/1755-1315/107/1/012002"
"Estimate of throughput of bridge transitions and pipe passages built on minor rivers of piedmont areas of krasnodar territory-russia","10.1051/MATECCONF/201816203011"
"Conservation of damage to library materials caused by flooding, and proposed preventive measures","10.17018/PORTAL.2018.9"
"Interactive flood hazard visualisation in adobe flash","10.1111/JFR3.12188"
"A successful practical experience with dedicated geostationary operational environmental satellites goes-10 and-12 supporting brazil","10.1175/BAMS-D-16-0029.1"
"Suitability of a lumped rainfall-runoff model for flashy tropical watersheds in new caledonia","10.1080/02626667.2018.1523613"
"Farmers' perception on the sustainability of as a climate change adaptation strategy in agusan agusan del sur and north cotobato, philippines",NA
"Post-disaster recovery is a marathon, not a sprint the need for a state-sponsored recovery scheme","10.24135/PJR.V24I1.402"
"Arc flash hazards of 125 vdc station battery systems",NA
"Stronger effects of heterozygosity on survival in harsher environments","10.1111/JFB.13827"
"Impacts of large flood along a mountain river basin: the importance of channel widening and estimating the large wood budget in the upper emme river (switzerland)","10.5194/ESURF-6-1115-2018"
"Hydrologic analysis of the challenges facing water resources and sustainable development of wadi feiran basin, southern sinai, egypt","10.1007/S10040-018-1764-8"
"An integrated analysis of the eutrophication process in the enxoe reservoir within the dpsir framework","10.3390/W10111576"
"Impact of the representation of the freshwater river input in the western mediterranean sea","10.1016/J.OCEMOD.2018.09.005"
"Convection-permitting regional climate simulations for representing floods in small- and medium-sized catchments in the eastern alps","10.5194/NHESS-18-2653-2018"
"Using a multi-hypothesis framework to improve the understanding of flow dynamics during flash floods","10.5194/HESS-22-5317-2018"
"Assessment of pluvial floods potential on the rivers of the republic of moldova","10.2478/PESD-2018-0034"
"Finite element modelling of landslide prone slopes around rudraprayag and agastyamuni in uttarakhand himalayan terrain","10.1007/S11069-018-3381-1"
"Hydrodynamic simulation of a cloudburst event in asi ganga valley of indian himalayan region using mike11 and gis techniques",NA
"Miconia rheophytica (melastomataceae: miconieae), a new and endangered species from the magdalena medio region of colombia","10.11646/PHYTOTAXA.371.1.7"
"Statistical characteristics of cloud burst and mini-cloud burst events during monsoon season in india","10.1002/JOC.5560"
"Development of aromatic glutinous rice for rainfed lowland areas by marker assisted selection",NA
"Transient early diagenetic processes in rhone prodelta sediments revealed in contrasting flood events","10.1016/J.CSR.2018.07.005"
"Effectiveness of the submersible embankment in haor area in bangladesh","10.20965/JDR.2018.P0780"
"Analysis of increasing flash flood frequency in the densely urbanized coastline of the campi flegrei volcanic area, italy (vol 6, pg 63, 2018)","10.3389/FEART.2018.00092"
"A multidisciplinary approach for clarifying the recharge processes and origin of saline water in the semi-arid punata alluvial fan in bolivia","10.3390/W10070946"
"Modelling of rainfall-induced runoff and superficial erosion in unsaturated air-fall soil deposits","10.19199/2018.3.0557-1405.31"
"Ensemble model to enhance robustness of flash flood forecasting using an artificial neural network: case-study on the gardon basin (south-eastern france)","10.21701/BOLGEOMIN.129.3.007"
"The impact of the parameterisation of physiographic features of urbanised catchment areas on the spatial distribution of components of the water balance using the wetspass model","10.3390/IJGI7070278"
"Are urban floods flash floods?","10.1051/LHB:200402010"
"A modified xinanjing model for simulating small basin flash flood","10.1201/9781439833858.CH15"
"The jubaguerra stream event: analysis of a mass movement connected with a flash flood phenomenon and its application to other areas in the gredos mountains (central spain)",NA
"On the use of spatiotemporal techniques for the assessment of flash flood warning",NA
"The origin and behavior of a flood capping layer deposited on contaminated sediments of the saguenay fjord (quebec)","10.1520/STP11549S"
"Sediment and nutrient flood loads in three small mediterranean catchments",NA
"Effects and resilience of some soil chemical properties as a result of fire in an urban fringe",NA
"Comet((r)) flash flood cases: summary of characteristics",NA
"Applications of remotely sensed data in flood prediction and monitoring: report of the ceos disaster management support group flood team",NA
"Changes in land use and the growing number of flash floods in germany",NA
"Watershed morphometry and land characteristics for watershed hydrological response analysis: a remote sensing and gis-based approach",NA
"A distributed hydrological model of flash-floods",NA
"National basin delineation and flash flood database creation",NA
"Beyond flood detection: alternative applications of real-time data",NA
"The relationship between intense, short-duration precipitation and flash floods",NA
"Assessing the effects and effectiveness of flash flood mitigation strategies",NA
"Role of education in reducing flash flood effects",NA
"The influence of flash floods on the limnology of the albufera of valencia lagoon (spain)",NA
"Design considerations for the two c- and one s-band doppler weather radars in the islamic republic of iran","10.1016/S1464-1909(00)00139-8"
"Characterization of a xenon plasma electron flood gun on a gsd-200e(2) high current implanter using q(bd), flash, spider, and charm (tm)-2 wafers",NA
"Anthropogenic impacts on the formation of flash floods and measures for their compensation",NA
"Atmospheric rivers and national weather service watches, warnings, and advisories issued over california 2007-2016","10.15191/NWAJOM.2018.0608"
"Integrating gis and hec-ras to model assiut plateau runoff","10.1016/J.EJRS.2017.11.002"
"Evaluation of microphysics and cumulus schemes of wrf for forecasting of heavy monsoon rainfall over the southeastern hilly region of bangladesh","10.1007/S00024-018-1876-Z"
"A bias correction method for rainfall forecasts using backward storm tracking","10.3390/W10121728"
"On sustaining the ecology and livestock industry of the bayanbuluk grasslands","10.3724/SP.J.1227.2010.00057"
"Modelling water-harvesting systems in a semi arid catchment (merguellil-tunisia)","10.13031/2013.29389"
"Hydrometeorological analysis of flash floods in small basins located in headwater of wielopolka river on the 25th june 2009",NA
"Mapping urbanised areas and the flash flood hazards in northern france: challenges and perspectives",NA
"Agriculture: deforestation","10.1007/978-90-481-3058-0\_8"
"Flash floods, low water crossings and swift water rescues in texas",NA
"Flaflom - an early warning system for flash floods in egypt","10.2495/FRIAR100171"
"Reconstruction of flash flood event in a small catchment: nagykonyi, hungary","10.1127/0372-8854/2009/0053S3-0123"
"A physically-based radar calibration method for improved rainfall estimation: application to the fort-collins flash flood of 1997","10.1080/17415970802166527"
"Flash flood hydarologic processes of a small headwater catchment in hong kong","10.1007/978-3-540-89465-0\_13"
"A torrential precipitation event in the eastern part of romania-a case study",NA
"Natural hazards and environmental implications in nepal","10.1108/09653560911003679"
"Coupling hydrological-hydraulic models for extreme flood simulating and forecasting on the north central coast of vietnam","10.2495/RM090111"
"Distributed hydro-meteorological simulation for a road submersion warning system in the gard region (france)","10.1051/LHB/2009081"
"Exploiting the capture effect for low-latency flooding in wireless sensor networks",NA
"Features of the large-scale circulation of the extremely heavy rain with severe floods over south china in june 2005 and its possible cause","10.1117/12.791771"
"Damage caused by typhoon-induced lahar flows from mayon volcano, philippines","10.3208/SANDF.47.1123"
"Solutions for initial-boundary-value problems representing gravity currents arising from variable inflow","10.1111/J.1365-2966.2007.00381.X"
"Comment on ``investigation of the hydrodynamics of flash floods in ephemeral channels: scaling analysis and simulation using a shock-capturing flow model incorporating the effects of transmission losses by s.m. Mudd, 2006. Journal of hydrology 324, 65-79","10.1016/J.JHYDROL.2006.11.022"
"Troubleshooting a packing maldistribution upset","10.1205/CHERD06068"
"Identifying sources of recharge to shallow aquifers using a groundwater model","10.1016/J.AGWAT.2006.05.007"
"Badoosh dam-break hypothetical using hec-ras",NA
"Cached guaranteed-timer random drop against tcp syn-flood attacks and flash crowds",NA
"Hydrological impacts of climatic variability on water resources of the damodar river basin, india",NA
"Handling high-bandwidth traffic aggregates by receiver-driven feedback control",NA
"1-d shallow water models for dam break flash floods with different junction and bend treatments",NA
"Analysis of the flash flood occurred on 18 january 2010 in wadi el arish, egypt (a case study)","10.1080/19475705.2012.731657"
"Modeling of morphou flood and remedial measures",NA
"Comparison of two stream gauging systems for measuring runoff and sediment yield for a semi-arid watershed","10.1002/ESP.3287"
"Flash flood forecasting using support vector regression: an event clustering based approach","10.1109/MLSP.2013.6661958"
"Flash floods mitigation measures for ungauged basins (case study pojorata subbasin)",NA
"Eolian and fluvial sedimentation in the southwestern sinai mountains, egypt: a record of flash floods during the late pleistocene","10.2166/NH.2012.172"
"Structure, maintenance and development of a stationary convective system generated over a mountain slope adjoining a bay in summer","10.2151/JMSJ.2012-515"
"Influence of a flood event on salinity and nutrients in the changshan archipelago area (northern yellow sea)","10.1007/S11802-012-1913-Y"
"Upstream guppies (poecilia reticulata, peters, 1859) go against the flow","10.1590/S1676-06032012000300006"
"A segregated flow scheme to control numerical dispersion for multi-component flow simulations","10.1007/S10596-012-9278-2"
"The effects of intensive rainfalls (flash floods) on the development on the landforms in the koszeg mountains (hungary)","10.2478/S13533-011-0061-Z"
"Relations between streamflow indices, rainfall characteristics and catchment physical descriptors for flash flood events",NA
"Nmq/q2: national mosaic and multi-sensor qpe system",NA
"Evaluation and improvement of c-band radar attenuation correction for operational flash flood forecasting",NA
"Flood nowcasting in the southern swiss alps using radar ensemble",NA
"The flooding potential of convective rain cells",NA
"Flash flood forecasting using data-based mechanistic models and radar rainfall forecasts",NA
"Flood hazard in wadi rahbaa area, egypt","10.1007/S12517-010-0144-Z"
"New methods of flash flood forecasting in the czech republic",NA
"Holocene land use in western sicily: a geoarchaeological perspective","10.1144/SP352.8"
"Observations on the caddisfly fauna (insecta, trichoptera) of the lower orange and fish rivers in southern africa with the description of a new species",NA
"Assessment of flash flood events using remote sensing and atmospheric model-derived precipitation in a hydrological model",NA
"Stratigraphy and sedimentology of the paleoproterozoic thluicho lake group, southwestern rae province, canada: alluvial basin development in the hinterland of the taltson orogen","10.1086/655373"
"Statistical comparison between consecutive winter and summer concentrations in zinc and lead from sediments in a tropical urban estuary in mauritius","10.1007/S10661-009-1118-Z"
"Application time of nitrogen and phosphorus fertilization mitigates the adverse effect of submergence in rice (oryza sativa l.)","10.1017/S0014479714000453"
"Flash floods in the guelmim area/southwest morocco-use of remote sensing and gis-tools for the detection of flooding-prone areas","10.3390/GEOSCIENCES5020203"
