"","x"
"Denial-of-service attack-detection techniques","10.1109/MIC.2006.5"
"A numerical study of three catastrophic precipitating events over southern france. I: numerical framework and synoptic ingredients","10.1002/QJ.200"
"A distributed hydrologic model and threshold frequency-based method for flash flood forecasting at ungauged locations","10.1016/J.JHYDROL.2007.02.015"
"Product-error-driven generator of probable rainfall conditioned on wsr-88d precipitation estimates","10.1029/2008WR006946"
"Regional frequency analysis of extreme precipitation in the eastern italian alps and the august 29, 2003 flash flood","10.1016/J.JHYDROL.2007.07.009"
"Mesoscale meteorological features associated with heavy precipitation in the southern alpine region","10.1007/S007030050011"
"The future intensification of hourly precipitation extremes","10.1038/NCLIMATE3168"
"A review of advances in flash flood forecasting","10.1002/HYP.8040"
"Spatio-temporal variability of event runoff coefficients","10.1016/J.JHYDROL.2006.06.008"
"Storm-scale numerical rainfall prediction for five precipitating events over france: on the importance of the initial humidity field","10.1175/1520-0434(2002)017<1236:SSNRPF>2.0.CO;2"
"Wrf high resolution dynamical downscaling of era-interim for portugal","10.1007/S00382-012-1315-2"
"Resistance and resilience of macroinvertebrate assemblages to drying and flood in a tallgrass prairie stream system","10.1023/B:HYDR.0000043188.53497.9B"
"High-resolution non-hydrostatic simulations of flash-flood episodes with grid-nesting and ice-phase parameterization","10.1007/S007030050016"
"Chemical erosion in the eastern himalaya: major ion composition of the brahmaputra and delta c-13 of dissolved inorganic carbon","10.1016/J.GCA.2005.02.033"
"Comparison of three downscaling methods in simulating the impact of climate change on the hydrology of mediterranean basins","10.1016/J.JHYDROL.2009.09.050"
"Surveying flash floods: gauging the ungauged extremes","10.1002/HYP.7111"
"The regional hydrology of extreme floods in an urbanizing drainage basin","10.1175/1525-7541(2002)003<0267:TRHOEF>2.0.CO;2"
"Rain event properties in nature and in rainfall simulation experiments: a comparative review with recommendations for increasingly systematic study and reporting","10.1002/HYP.7045"
"Cold pools and mcs propagation: forecasting the motion of downwind-developing mcss","10.1175/1520-0434(2003)018<0997:CPAMPF>2.0.CO;2"
"Elongation ability and non-structural carbohydrate levels in relation to submergence tolerance in rice","10.1016/J.PLANTSCI.2004.07.023"
"Vertebrate burrow complexes from, the early triassic cynognathus zone (driekoppen formation, beaufort group) of the karoo basin, south africa","10.2307/3515526"
"Radar for hydrology: unfulfilled promise or unrecognized potential?","10.1016/J.ADVWATRES.2012.05.005"
"Planted forests and water in perspective","10.1016/J.FORECO.2007.06.010"
"Linkages between microbial and hydrologic processes in arid and semiarid watersheds","10.1890/03-0567"
"Some common ingredients for heavy orographic rainfall","10.1175/1520-0434(2001)016<0633:SCIFHO>2.0.CO;2"
"Convective-scale warn-on-forecast system a vision for 2020","10.1175/2009BAMS2795.1"
"Hydrometeorological analysis of the 29 august 2003 flash flood in the eastern italian alps","10.1175/JHM593.1"
"Regional scale flood modeling using nexrad rainfall, gis, and hec-hms/ras: a case study for the san antonio river basin summer 2002 storm event","10.1016/J.JENVMAN.2004.11.024"
"Organization and environmental properties of extreme-rain-producing mesoscale convective systems","10.1175/MWR2899.1"
"A process typology of regional floods","10.1029/2002WR001952"
"Effects of differing wildfire severities on soil wettability and implications for hydrological response","10.1016/J.JHYDROL.2005.06.038"
"Hymex-sopi the field campaign dedicated to heavy precipitation and flash flooding in the northwestern mediterranean","10.1175/BAMS-D-12-00244.1"
"Flash flood warning based on rainfall thresholds and soil moisture conditions: an assessment for gauged and ungauged basins","10.1016/J.JHYDROL.2008.08.023"
"Synoptic climatology of major floods in the negev desert, israel","10.1002/JOC.766"
"Real - ensemble radar precipitation estimation for hydrology in a mountainous region","10.1002/QJ.375"
"Status and outlook of operational satellite precipitation algorithms for extreme-precipitation events","10.1175/1520-0434(2003)018<1037:SAOOOS>2.0.CO;2"
"A review of the potential impacts of climate change on surface water quality","10.1623/HYSJ.54.1.101"
"The arome-france convective-scale operational model","10.1175/2010MWR3425.1"
"Radar hydrology: rainfall estimation","10.1016/S0309-1708(02)00062-3"
"An overview of the international h2o project (ihop\_2002) and some preliminary highlights","10.1175/BAMS-85-2-253"
"Future changes to the intensity and frequency of short-duration extreme rainfall","10.1002/2014RG000464"
"The paradoxical increase of mediterranean extreme daily rainfall in spite of decrease in total values","10.1029/2001GL013554"
"Heavier summer downpours with climate change revealed by weather forecast resolution model","10.1038/NCLIMATE2258"
"The catastrophic flash-flood event of 8-9 september 2002 in the gard region, france: a first case study for the cevennes-vivarais mediterranean hydrometeorological observatory","10.1175/JHM-400.1"
"A review on regional convection-permitting climate modeling: demonstrations, prospects, and challenges","10.1002/2014RG000475"
"Adaptive quadtree simulation of shallow flows with wet-dry fronts over complex topography","10.1016/J.COMPFLUID.2008.02.008"
"Strengthening local authorities in flood risk management: a case study from naga, the philippines",NA
"Rainfall estimate for flood management using meteorological data from satellite imagery",NA
"Web based 3d visual user interface to a flood forecasting system",NA
"Water level forecasts for lake managua",NA
"Geological hazards and anthropogenic impacts on the environment in malawi: lesson from a case study of debris flows in zomba",NA
"Improved flash flood predictions",NA
"Quantitative landslide risk assessment of cairns, australia",NA
"Psychological impacts of flash flooding in the klang valley, malaysia",NA
"Combining dendrogeomorphological and topographical techniques for hydraulic modelling in mountain streams",NA
"The flooding of the ebro in 2007: hydrometeorlogical processes and risk management perspectives",NA
"Risk of flooding underground facilities after malfunction of flood-protections measures",NA
"Flash flooding in spain: geomorphological approaches supporting flood frequency analysis, and the implications for the design of structures","10.1111/J.1747-6593.2006.00063.X"
"Flood risk management in french mediterranean basins","10.2495/RM070251"
"Towards a demonstrator of flash flood warning system a case study for st. Maarten, the netherlands",NA
"Regional climate change - to be included in future flood risk analysis?",NA
"The effects of urbanization on the natural drainage patterns and the increase of urban floods: case study metropolis of mashhad-iran",NA
"A distributed real-time semiarid flash-flood forecasting model utilizing radar data",NA
"The identification of vulnerable localities to flash flows from the inferior basin of jijia river through the physiographic method",NA
"Potential flash flood risk assessment model and its application in sub-basin",NA
"Diagnosis of flood risk in south bay area using hydrology analysis",NA
"Multiscale sediment-laden flow theory and its application in flood risk management",NA
"Rapid screening of flash flood-affected watersheds in hungary","10.1127/0372-8854/2011/0055S1-0033"
"Risk analysis: major flash floods in the upper river basin of mures. Stanceni",NA
"Mountain risks in downstream water resource management in upper bhagirathi basin, indian himalayas",NA
"Highlands management in a flood-prone watershed: does reflexive reciprocity make a difference?","10.1016/J.GLOENVCHA.2010.01.003"
"Analysis on flood induced rainfall characteristics in the upper nan watershed",NA
"Extreme flood effects as a combination of river and sea action",NA
"Mathematical models for early warning systems",NA
"Fuzzy decision tree in a homeland security application",NA
"Floods","10.1007/978-90-481-3403-8\_7"
"Flash floods - the prototype of methodology and application of the early warning system",NA
"Using gis to produce vulnerability maps of non-gauged watersheds area","10.1007/978-90-481-3658-2\_19"
"Forests and water vulnerability under climate change impact in the putna river basin - vrancea",NA
"The 1773 cava de' tirreni flash flood (southern italy), an opportunity to further enhance the use of documentary sources as hazard and risk assessment","10.1007/978-3-319-09048-1\_167"
"Operational tools to help stakeholders to protect and alert municipalities facing uncertainties and changes in karst flash floods","10.5194/PIAHS-370-201-2015"
"Regional and flash flood as a limiting factor for development","10.5817/CZ.MUNI.P210-7861-2015-82"
"Building a probability flood risk model, using gis, logistic regression and fuzzy weights",NA
"Appropriate flood risk assessment tools for predicting flood inundation extent and assessing flood hazard risk for flash flood events",NA
"Geospatial perspectives on hydro-meteorological hazards and groundwater hazard in india",NA
"Recent advances in eulerian and lagragian large-scale particle image velocimetry",NA
"Using documentary data to reconstruct social responses and local-based adaptation strategies to landslide and flood hazards in n czechia","10.1007/978-3-319-09408-3\_77"
"Large wood transport influence on flash flood risk in a mountain village in central spain","10.1007/978-3-319-09054-2\_23"
"Management of flash floods and soil erosion in dresden",NA
"Development of gis-based ffpi for china's flash flood forecasting",NA
"Flash flood assessment for wadi mousa city-jordan","10.1016/S2212-5671(14)00990-3"
"Forecasting extreme flooding using weather radar and uncertainty modelling",NA
"A missed window of opportunity","10.1007/978-3-319-09303-1\_36"
"Remote sensing and gis approach for hazard vulnerability assessment of upper alaknanda basin, garhwal himalaya (uttarakhand), india","10.1007/978-4-431-54871-3\_20"
"Methodology for risk assessment of flash flood events due to climate and land-use changes: application to the llobregat basin","10.2166/WCC.2014.027"
"Cloudburst and landslides in uttarakhand: nature's fury?",NA
"Spatial coexistence and temporal logout between mainland and marine hazards in upper normandy (nw france)",NA
"Assessing the uncertainties of radar rainfall prediction and runoff simulation parameter: toward an operational ensemble flood forecasting in urban river basin",NA
"Flash flood risk analysis at matoupu town",NA
"China's western region of mountain hazards risk and prevention measures",NA
"Impact of earthquake induced landslides on hydrologic response in jianpinggou catchment",NA
"Estimation of flood hazard risk relating to vehicles",NA
"Forming conditions for flash floods",NA
"Flood risk perception and preparedness: emerging insights from selected case studies in the curvature carpathians and subcarpathians (romania)",NA
"A new french flash flood warning service","10.1051/E3SCONF/20160718024"
"Flood risk management: cases studies in french mediterranean area","10.1051/E3SCONF/20160720019"
"From the risk culture to the local cultures of risk. An ethnographic investigation of living with a constant flood risk in the south east of france","10.1051/E3SCONF/20160708005"
"From the risk culture to the local cultures of risk. An ethnographic investigation of living with a constant flood risk in the south east of france","10.1051/E3SCONF/20160709001"
"Reclamation's empirical method for estimating life loss due to dam failure","10.1051/E3SCONF/20160706002"
"The type of vegetation as a driver for the suscetibility to landslide in the madeira island: the case of tabua watershed","10.14195/978-989-26-1237-9\_9"
"Lessons from the autumn 2014 flash floods in the city of nimes and its neighborhood (france): behavior of several mitigation dams and hydrological analysis","10.1051/E3SCONF/20160716002"
"Tangible and intangible flood damage evaluation","10.1051/E3SCONF/20160705007"
"Reducing the risk of flooding and avoiding the losses caused by flash floods",NA
"Assessing flash flood vulnerability using a multi-vulnerability approach","10.1051/E3SCONF/20160708004"
"A synthesized vulnerability assessment: case study of biophysical and social vulnerability in taitung county, taiwan",NA
"Analysis of flash floods occurred and registered at the darmanesti hydrometric station within the uz hydrographic basin",NA
"The flood impact assessment from ilisua catchment area on the environment","10.1016/J.PROENG.2016.08.810"
"Effectiveness and applicability of flood barriers for risk mitigation in flash-flood prone mediterranean area","10.1051/E3SCONF/20160712010"
"Reducing risk from lahar hazard in volcanic catchment: retarding basin site assessment",NA
"Monitoring and forecasting of intensive convective precipitation with the use of the mobile meteorological radar (mmr50)","10.1051/MATECCONF/20167605010"
"Spatial modulation of the hydrological risk at praia, cape verde","10.1088/1755-1315/37/1/012071"
"Analytic back calculation of debris flow damage incurred to a masonry building: the case of scaletta zanclea 2009 event","10.1051/E3SCONF/20160704007"
"Flood risk assessment from flash floods in bodva river basin, slovakia","10.1007/978-3-319-39639-2\_51"
"Management of risk from flash floods in the south-eastern slovakia","10.1016/J.PROENG.2016.08.781"
"Rainfall-runoff research on upland fields and a comparison of kinematic wave and improved tank models","10.1002/IRD.1899"
"Inter-urban floods modeling, management and vulnerability analysis applying swmm in north parts of tehran",NA
"Flood risk and reduction approaches in pakistan","10.1007/978-4-431-55369-4\_4"
"Geo-hydrological risk management on the amalfi coast: the village of atrani emergency plan","10.1007/978-3-319-09048-1\_158"
"Vulnerability of transport infrastructure to extreme weather events in small rural catchments",NA
"Characterization of flood hazard at a municipal level. A case study in tillaberi region, niger",NA
"Rainfall thresholds derivation for warning pluvial flooding risk in urbanised areas","10.1051/E3SCONF/20160718016"
"Dynamical flash flood risk forecast","10.1007/978-3-319-61297-3\_27"
"Dendrogeomorphic potential of the himalaya - case studies of process dating of natural hazards in kullu valley, himachal pradesh","10.18520/CS/V113/I12/2317-2324"
"Frequency and seasonality of flash floods in slovenia","10.5937/GP21-16074"
"Flash flooding as a threat to settlements even in remote areas","10.1177/0956247816672158"
"Management of non-structural measures in the prevention of flash floods: a case study in the city of duque de caxias, state of rio de janeiro, brazil","10.1007/S11069-017-2966-4"
"Lessons learned from tropical cyclone pam to vanuatu (melanesia): coastal hazards and flash flood and damages","10.4000/GEOMORPHOLOGIE.11842"
"Household labelling for flash flood emergency management (chrastava town, northern czechia)","10.1080/17445647.2017.1378137"
"Enhancing the effectiveness of flood road gauges with color coding","10.1007/S11069-017-2856-9"
"Can strategies to cope with hazard shocks be explained by at-risk households' socioeconomic asset profile? Evidence from tropical cyclone-prone coastal bangladesh","10.1007/S13753-017-0119-8"
"Flood disasters and land use planning in swat valley, eastern hindu kush","10.1007/978-4-431-56442-3\_10"
"Flood risk evaluation to multiple components on the coast of maresme","10.1080/23863781.2017.1381453"
"Risk mapping of urban areas prone to flash floods in mountain basins using the analytic hierarchy process and geographical information systems",NA
"A place for smartphone technologies and digital social networks (rsn) in institutional flood warning systems in france?","10.4000/CYBERGEO.27875"
"Characteristics, causes and hazards of large-scale debris flows on june 23 at haitong watershed, tibet, china","10.1007/978-3-319-53485-5\_67"
"Community area risk assessment for flash flood","10.5817/CZ.MUNI.P210-8587-2017-64"
"Early detection of baby-rain-cell aloft in a severe storm and risk projection for urban flash flood","10.1155/2017/5962356"
"The flood of the river turiaat teruel in june 1933: an assessment","10.21138/BAGE.2493"
"A self adaptive telemetry station for flash flood early warning systems",NA
"The development of flood map in malaysia","10.1063/1.5011632"
"An historical database on alluvial events in torrential catchments of campania region (southern italy)","10.3301/ROL.2016.101"
"Flash floods vigilance maps complexity. Findings and possible evolutions","10.1051/LHB/2016023"
"Towards a sustainable capital city: an approach for flood management and artificial recharge in naturally water-scarce regions, central region of saudi arabia","10.1007/S12517-015-2021-2"
"Improving flood maps in ungauged fluvial basins with dendrogeomorphological data. An example from the caldera de taburiente national park (canary islands, spain)","10.3390/GEOSCIENCES8080300"
"Increasing flash floods in a drying climate over southwest china","10.1007/S00376-018-7275-7"
"Dendrogeomorphological evidence of flood frequency changes and human activities (portaine basin, spanish pyrenees)","10.3959/1536-1098-74.2.144"
"Vulnerability aspects of urban flooding: a review","10.5958/2322-0430.2018.00175.0"
"The september 2017 flood in elblag (poland) in perspective","10.26491/MHWM/92406"
"Characterizing the flash flooding risks from 2011 to 2016 over china","10.3390/W10060704"
"Reconstruction and post-event analysis of a flash flood in a small ungauged basin: a case study in slovak territory","10.1007/S11069-018-3222-2"
"Post-earthquake denudation and its impacts on ancient civilizations in the chengdu longmenshan region, china","10.1016/J.GEOMORPH.2018.02.007"
"Predicting flood hazard indices in torrential or flashy river basins and catchments","10.1007/S11269-018-1932-6"
"An analysis of physical vulnerability to flash floods in the small mountainous watershed of aceh besar regency, aceh province, indonesia","10.4102/JAMBA.V10I1.550"
"A model to explain information seeking behaviour by individuals in the response phase of a disaster","10.1016/J.LISR.2018.05.001"
"Review and prospects of hydrological component development of escap/wmo typhoon committee","10.6057/2018TCRR01.02"
"Experiments on impact-based forecasting and risk-based warning of typhoon in china","10.6057/2018TCRR01.04"
"Disaster risks in peri-urban areas of the great metropolitan area -past and recent considerations: guidelines and real scopes of risk management and land-use planning, aserri, alajuelita, desamparados, escazu, santa ana and mora cantons","10.15359/RGAC.60-1.8"
"Developing agricultural damage simulation in the impact of typhoon and flashflood in laguna",NA
"Poster abstract: reputation system for ensuring data trustworthiness of crowdsourced weather stations","10.1145/3276774.3281020"
"Reliability-based estimation of traffic interruption probability due to road waterlogging","10.1155/2018/2850546"
"Remote sensing, gis and hec-ras techniques, applied for flood extent validation, based on landsat imagery, lidar and hydrological data. Case study: baseu river, romania",NA
"Flood risk assessments of transportation networks utilizing depth-disruption function",NA
"Building community resilience to flash floods: lessons learnt from a case study in the valles urban area, slp, mexico","10.1007/978-3-319-56469-2\_18"
"Artificial intelligence based multi-modal sensing for flash flood investigation",NA
"Estimation of potential flash flood risk in a basin using morphometric parameters: a case study of akcay basin","10.17341/GAZIMMFD.416429"
"The environmental study on flash flood risk zonation based on trapezoidal fuzzy number and grey clustering",NA
"Vulnerability assessment of the josanicka river basin to torrential floods and forest fires",NA
"Risk assessment and reduction measures in landslide and flash flood-prone areas: a case of southern thailand (nakhon si thammarat province)","10.1016/B978-0-12-812056-9.00017-8"
"Characteristic analysis of a flash flood-affected creek catchment using lidar-derived dem",NA
"Multiple risk assessment for various natural hazards for georgia","10.3233/978-1-58603-948-6-11"
"Spatial and temporal prediction of flash floods in ungauged area based on gis","10.1007/978-3-540-89465-0\_22"
"Flood risk assessment in coastal drainage basins through a multivariate analysis within a gis-based model",NA
"Floods and their risk assessment in east siberia","10.1007/978-90-481-2344-5\_27"
"The hydrometeorological forecasting in the framework of the european project flash","10.1051/LHB/2009080"
"Managing urban water disasters in gujarat: risk assessment and risk reduction",NA
"Hazards influencing coastal plains management along the eastern stretch of the gulf of suez, using remote sensing and gis",NA
"Sir-c/x space shuttle images contribution in assessment of flood risk. The case of athens basin.",NA
"Strategy for assessment of disaster risk using typhoon hazards modeling based on chlorophyll-a content of seawater","10.1186/S13638-018-1293-0"
"Evaluation of various probability distributions for deriving design flood featuring right-tail events in pakistan","10.3390/W10111603"
"Modeling sediment movement and channel response to rainfall variability after a major earthquake","10.1016/J.GEOMORPH.2018.07.022"
"Influence of solid waste and topography on urban floods: the case of mexico city","10.1007/S13280-018-1023-1"
"Fuzzy rule-based assessment of runoff for abha, saudi arabia, using the watershed modeling system (wms) software","10.1007/S13369-018-3177-3"
"A statistical approach to mapping flood susceptibility in the lower connecticut river valley region","10.1029/2018WR023018"
"Understanding the implementation challenges of urban resilience policies: investigating the influence of urban geological risk in thessaloniki, greece","10.3390/SU10103573"
"Flood prediction and mitigation in coastal tourism areas, a case study: hurghada, egypt","10.1007/S11069-018-3316-X"
"Farmers' net income distribution and regional vulnerability to climate change: an empirical study of bangladesh","10.3390/CLI6030065"
"An integrated hydrological-hydraulic model for simulating surface water flows of a shallow lake surrounded by large floodplains","10.3390/W10091213"
"Application of bayesian approach to dynamic assessment of flood in urban underground spaces","10.3390/W10091112"
"Flash floods in malir basin due to urbanizatioin","10.1109/IGARSS.2016.7730168"
"Urban areas and procedures for responding to extreme rainfall events: phenomenon analysis and protection strategies","10.6092/2281-4574/3737"
"Experimental study of the interaction between building clusters and flash floods","10.1007/S11629-014-3170-6"
"Analysis of landslide risk area susceptibility using gis: a case study of injegun, gangwondo, south korea",NA
"Urban land use and geohazards in itanagar, arunachal pradesh, india: the need for geotechnical intervention and geoethical policies in urban disaster resilience programmes in a changing climate","10.1144/SP419.15"
"Flash floods risk perception to support social resilience in the bend subcarpathians, romania",NA
"Lessons learned from the big floods, 1999-2013: the bavarian flood action programme 2020plus","10.2166/WP.2015.007"
"Spatial and temporal analysis of dry/wet conditions in ozana drainage basin, romania using the standardized precipitation index",NA
"Advances in the analysis of in-stream large wood: recruitment, transport and influence on flood risk","10.17735/CYG.V29I3-4.29773"
"Development of priority setting process for the small stream restoration projects using multi criteria decision analysis","10.2166/HYDRO.2014.058"
"Remote sensing-based studies coupled with field data reveal urgent solutions to avert the risk of flash floods in the wadi qus (east of jeddah) kingdom of saudi arabia","10.1007/S11069-014-1383-1"
"Analysis of flash flood scenarios in an urbanized catchment using a two-dimensional hydraulic model",NA
"Small watershed management as a tool of flood risk prevention",NA
"Land use based urban vulnerability to climate change assessment","10.3846/ENVIRO.2014.122"
"Assessment of food hazard and risk using gis and historical data. Case-study: the niraj river basin (transylvania depression, romania)",NA
"Developments in uk flood forecasting will lead to major reduction in flash-flood risk","10.1680/CIEN.2013.166.3.101"
"Climate change impact on small coastal river basins: from problem identification to adaptation in klaipeda city","10.1080/17565529.2013.789789"
"Numerical analysis of emergency river restoration scheme for qingping mega debris flow","10.1007/S11629-013-2120-Z"
"Flash flood prediction model based on multiple regression analysis for decision support system",NA
"Ensemble short-term rainfall-runoff prediction and its application in urban flood risk mapping",NA
"Semidistributed hydrologic model for flood risk assessment in the pejibaye river basin, costa rica","10.1061/(ASCE)HE.1943-5584.0000568"
"Applicability of satellite-based rainfall algorithms for estimating flood-related rainfall events in the mid-latitudes. Part ii: temporal integration","10.1111/J.1753-318X.2012.01138.X"
"Distributed flood forecasting for the management of the road network in the gard region (france)",NA
"On the meteorological and hydrological mechanisms resulting in the 2003 post-fire flood event in alpine shire, victoria","10.22499/2.6101.003"
"Monitoring urban land cover with the use of satellite remote sensing techniques as a means of flood risk assessment in cyprus","10.1117/12.898185"
